{
	"review_summary": "Internal review completed with material issues identified for follow-up.",
	"material_changes": ["Liability cap redlined from fees paid to total contract value."],
	"unresolved_items": ["Confirm whether the counterparty will accept the data processing addendum."],
	"confidence_score": 0.9
}
